product_id;product_name;"Total offerts";"Prix d'achat";"Prix unitaire HT";"Prix total HT";gift_message
185;"Magazine 1000 raisons de croire - N° Mag 1000 Raisons de croire : N°1 : Si tu existes, envoie-moi un signe !";26;0.000000;4.644550;120.758300;FR-GRATUIT-CMD
180;"Marie, mon secret";1;4.050000;9.004739;9.004739;FR-GRATUIT-CMD
176;"Bernadette et Lourdes _ L'enquête";1;6.355000;14.123223;14.123223;FR-GRATUIT-CMD
172;"Neuvaine à Soeur Joséfa Menendèz";100;0.848700;4.739336;473.933600;
168;"Calendrier de l'Avent Marie qui défait les Noeuds";5;2.000000;8.250000;41.250000;
164;"EDITION GRATUITE Neuvaine Marie qui défait les noeuds";3809;0.000000;0.000000;0.000000;FR-GRATUIT-CMD
157;"Affiche A4 Marie qui défait les Noeuds - Nouvelle version -  : Unité";1;0.194000;2.500000;2.500000;FR-GRATUIT-CMD
152;"Soyez rationnel, devenez catholique ""Edition abrégée""";46;1.410000;15.165877;697.630342;FR-GRATUIT-CMD
148;"Neuvaine à Padre Pio";25;0.333900;4.739336;118.483400;
146;"Neuvaine à la Miséricorde Divine";12;0.647200;4.739336;56.872032;FR-GRATUIT-CMD
145;"Neuvaine à Saint Antoine de Padoue";10;0.771000;4.739336;47.393360;FR-GRATUIT-CMD
144;"EDITION GRATUITE Marie et la France -Edition Notre Dame de Paris";201;0.610000;0.000000;0.000000;FR-GRATUIT-CMD
142;"Neuvaine à Marie Reine des Coeurs";5;2.697000;4.739336;23.696680;FR-GRATUIT-CMD
141;"Neuvaine intégrale Marie qui défait les noeuds reliée et enluminée";111;2.522000;18.009479;1999.052169;FR-GRATUIT-CMD
140;"Neuvaine à Marie qui défait les noeuds - Version originale 2022";21;0.000000;4.739336;99.526056;FR-GRATUIT-CMD
139;"Et si c'était vrai ? La foi chrétienne à la loupe";193;2.042199;20.853081;4024.644633;FR-GRATUIT-CMD
136;"Bernadette ne nous a pas trompés";73;2.390000;20.853081;1522.274913;FR-GRATUIT-CMD
135;"Magazine Ave Maria - N° Ave Maria : 73 : Marie et Jeanne, les deux patronnes qui veillent sur la France";33;0.000000;0.000000;0.000000;FR-GRATUIT-CMD
135;"Magazine Ave Maria - N° Ave Maria : 71 : Jésus, fils de Joseph";22;0.000000;0.000000;0.000000;FR-GRATUIT-CMD
135;"Magazine Ave Maria - N° Ave Maria : 69 : Retrouvons nos racines !";2;0.000000;0.000000;0.000000;
135;"Magazine Ave Maria - N° Ave Maria : 68 : France, royaume de Marie !";153;0.000000;0.000000;0.000000;FR-GRATUIT-CMD
135;"Magazine Ave Maria - N° Ave Maria : 67 : 2021... année de Saint Joseph";1;0.000000;0.000000;0.000000;
135;"Magazine Ave Maria - N° Ave Maria : 66 : Elle est passée chez vous !";1;0.000000;0.000000;0.000000;FR-NLPATRON-CMD-
135;"Magazine Ave Maria - N° Ave Maria : 65 : Elle a pris les devants, notre reine !";83;0.000000;0.000000;0.000000;FR-GRATUIT-CMD
135;"Magazine Ave Maria - N° Ave Maria : 77 : Bernadette ne nous a pas trompés !";367;0.000000;0.000000;0.000000;FR-GRATUIT-CMD
135;"Magazine Ave Maria - N° Ave Maria : 78 : ""Fais moi connaître""";211;0.000000;0.000000;0.000000;FR-GRATUIT-CMD
135;"Magazine Ave Maria - N° Ave Maria : 79 : L'Église, notre héritage";179;0.000000;0.000000;0.000000;
135;"Magazine Ave Maria - N° Ave Maria : 80 : Publions les merveilles de Dieu !";298;0.000000;0.000000;0.000000;FR-UMM-CMD
134;"Neuvaine Prions Marie pour la paix";5;0.386800;4.739336;23.696680;FR-GRATUIT-CMD
132;"La Force des Martyrs";4;9.348000;18.009479;72.037916;FR-GRATUIT-CMD
131;"Neuvaine à Notre Dame de la Médaille Miraculeuse";6;0.848750;4.739336;28.436016;FR-GRATUIT-CMD
130;"Neuvaine à St Joseph pour préparer Noël en méditant les mystères de l'Avent";3;0.848700;4.739336;14.218008;FR-GRATUIT-CMD
128;"Bougie de neuvaine Marie qui défait les noeuds";2;2.043499;5.000000;10.000000;FR-GRATUIT-CMD
124;"Neuvaine à l'Archange Saint Michel";133;0.781600;4.739336;630.331688;FR-GRATUIT-CMD
123;"Neuvaine Marie qui défait les nœuds de la maladie - Version 2022";63;0.664000;4.739336;298.578168;FR-GRATUIT-CMD
122;"Neuvaine Marie qui défait les nœuds pour la famille - Version 2022";10;0.470000;4.739336;47.393360;FR-GRATUIT-CMD
121;"Neuvaine à l'Immaculée avec Maximilien Kolbe";200;0.780000;4.739336;947.867200;
116;"Soyez rationnel, devenez catholique";54;3.200000;22.748815;1228.436010;FR-GRATUIT-CMD
115;"Marie qui défait les noeuds, d'un miracle à une dévotion";47;1.330000;8.341232;392.037904;FR-GRATUIT-CMD
114;"Carte image Marie qui défait les Noeuds -  : Lot de 10 (-30%)";336;0.610000;1.250000;420.000000;FR-GRATUIT-CMD
114;"Carte image Marie qui défait les Noeuds -  : Unité";1163;0.610000;1.250000;1453.750000;FR-GRATUIT-CMD
114;"Carte image Marie qui défait les Noeuds -  : Lot de 20";40;0.610000;1.250000;50.000000;FR-GRATUIT-CMD
109;"Dieu, la Science, les preuves";8;13.650000;22.748815;181.990520;FR-GRATUIT-CMD
104;"Neuvaine de préparation pour se consacrer aux Cœurs Unis";1;1.110000;4.739336;4.739336;FR-GRATUIT-CMD
103;"EDITION GRATUITE - La Vocation de la France - Servir les cœurs unis de Jésus et Marie";267;0.610000;0.000000;0.000000;FR-GRATUIT-CMD
98;"EDITION GRATUITE Marie et la France - Un lien extraordinaire à redécouvrir";133;0.610000;0.000000;0.000000;FR-GRATUIT-CMD
97;"Marie qui défait les nœuds - Neuvaine intégrale, avec les citations bibliques - Version 2021";17;0.877600;6.540284;111.184828;FR-GRATUIT-CMD
95;"EDITION GRATUITE Maria Valtorta - Confirmation par la science";101;0.610000;0.000000;0.000000;FR-GRATUIT-CMD
94;"Maria Valtorta - Confirmation par la science -  : Unité";100;0.610000;8.341232;834.123200;
92;"Neuvaine à la Vierge Marie avec la petite Thérèse";50;1.000000;4.739336;236.966800;
91;"EDITION GRATUITE Lumière du Monde - La beauté de l'Église et le génie catholique";465;0.610000;0.000000;0.000000;FR-GRATUIT-CMD
90;"EDITION GRATUITE Joseph, modèle de vie - Si important pour notre temps";355;0.610000;0.000000;0.000000;FR-GRATUIT-CMD
89;"EDITION GRATUITE Le Linceul de Turin - Nouvelle preuve de la Résurrection du Christ";25;0.610000;0.000000;0.000000;FR-GRATUIT-CMD
87;"Neuvaine au Sacré-Cœur de Jésus pour la guérison de toutes les maladies";1;0.434000;4.739336;4.739336;FR-GRATUIT-CMD
86;"Neuvaine au Saint-Esprit avec Marie";1;0.328750;4.739336;4.739336;FR-GRATUIT-CMD
84;"Notre Histoire avec Marie";19;6.010000;27.488152;522.274888;FR-GRATUIT-CMD
82;"Neuvaine à Saint Joseph pour la famille";2;0.288050;4.739336;9.478672;FR-GRATUIT-CMD
81;"Neuvaine sur les pas de Bernadette pour redire « oui » à Dieu avec Marie";1;0.220000;4.739336;4.739336;FR-GRATUIT-CMD
78;"Mary who Unties Knots (EN)";20;0.320000;3.791469;75.829380;
76;"Marie die de knopen ontwart (NL)";18;0.250000;3.791469;68.246442;
73;"Maria desatadora de nudos (ES)";100;0.260000;3.791469;379.146900;
72;"Mary who unties knots  (chinese version)";6;3.060000;3.791469;22.748814;FR-GRATUIT-CMD
71;"Novena a Maria che scioglie i nodi (IT)";100;0.120000;3.791469;379.146900;
60;"Notre Dame qui défait les nœuds - Le cadeau du pape François au monde";3;2.089999;16.018957;48.056871;FR-GRATUIT-CMD
53;"Le livre de Saint Joseph - Le saint du XXIème siècle";1;0.100000;5.687204;5.687204;FR-GRATUIT-CMD
49;"Lumières sur Nazareth  Version Française";2;6.630000;26.540284;53.080568;
46;"Affichette format A2";1;0.000000;24.583333;24.583333;FR-GRATUIT-CMD
44;"Livret - neuvaine à Marie qui défait les noeuds";100;0.597280;3.791469;379.146900;FR-GRATUIT-CMD
36;"Neuvaine pour le travail - Marie qui défait les nœuds";136;0.180000;4.739336;644.549696;FR-GRATUIT-CMD
35;"Les vingt mystères de la neuvaine";170;0.200000;4.739336;805.687120;
34;"Lot de 5 livrets - neuvaine à Marie qui défait les nœuds";126;0.550000;13.270142;1672.037892;FR-GRATUIT-CMD
31;"Lumière du Monde - La beauté de l'Église et le génie catholique -  : Unité";7;0.610000;8.341232;58.388624;FR-GRATUIT-CMD
26;"Jésus, le Messie attendu par Israël - Selon les prophéties bibliques -  : Unité";17;0.610000;8.341232;141.800944;FR-GRATUIT-CMD
